url,name,address,city,state,phone
http://www.willingaccounting.com/,Results,"ÓÉą2929 Palmyra Rd, Hannibal, MO 63401",Hannibal,MO,Óāį(573) 221-4234
http://www.mccreadytax.com/,Results,"ÓÉą739 Grand Ave, Hannibal, MO 63401",Hannibal,MO,Óāį(573) 248-2999
https://www.wadestables.com/,Results,"ÓÉą100 N 6th St, Hannibal, MO 63401",Hannibal,MO,Óāį(573) 221-5998
https://www.libertytax.com/15576,Results,"ÓÉą2711 St Mary‚Äôs Ave, Hannibal, MO 63401",Hannibal,MO,Óāį(573) 221-2000
https://bloomaccountingsolutions.com/,Results,"ÓÉą1414 Country Club Dr, Hannibal, MO 63401",Hannibal,MO,Óāį(573) 231-9038
http://www.hannibalchamber.org/list/member/luck-humphreys-associates-199,Results,"ÓÉą3334 W Ely Rd, Hannibal, MO 63401",Hannibal,MO,Óāį(573) 221-4650
https://www.hrblock.com/tax-office-near-me/missouri/hannibal/14285/?otppartnerid=9308&campaignid=pw_mcm_9308_9762&utm_medium=local,Results,"ÓÉą106 Steamboat Bend Shopping Center Shop Ctr, Hannibal, MO 63401",Hannibal,MO,Óāį(573) 221-0759
https://www.myarrowta.com/,Results,"ÓÉą123 W Olive St, Palmyra, MO 63461",Palmyra,MO,Óāį(573) 769-2955
http://welchhawkepc.com/,Results,"ÓÉą1000 Center St, Hannibal, MO 63401",Hannibal,MO,Óāį(573) 221-0080
http://taxesandtrucking.com/,Results,"ÓÉą14312 Sawyer Dr, New London, MO 63459",New London,MO,Óāį(573) 248-4448
https://www.amfam.com/agents/missouri/neosho/justin-parker,Results,"ÓÉą105 N Maple Ave, Hannibal, MO 63401",Hannibal,MO,Óāį(573) 221-3200
http://www.facebook.com/TLB-Tax-Services-1013731505307749/,Results,"ÓÉą1025 S Main St, Palmyra, MO 63461",Palmyra,MO,Óāį(573) 773-2020
http://www.riverwealthfinancial.com/,Results,"ÓÉą2929 Palmyra Rd, Hannibal, MO 63401",Hannibal,MO,Óāį(573) 603-1449
https://www.psba.com/,Results,"ÓÉą801 Broadway #224, Hannibal, MO 63401",Hannibal,MO,Óāį(573) 406-0541
https://www.securityfinance.com/locations/hannibal-mo-0947?utm_source=googlebusiness&utm_medium=organic&utm_campaign=locallistings,Results,"ÓÉą3521 Stardust Dr, Hannibal, MO 63401",Hannibal,MO,Óāį(573) 406-0044
https://www.bensonfinancialgroup.com/,Results,"ÓÉą161 Progress Rd, Hannibal, MO 63401",Hannibal,MO,Óāį(573) 221-0444
https://dor.mo.gov/,Results,"ÓÉą21 Northport Plaza, Hannibal, MO 63401",Hannibal,MO,Óāį(573) 719-3108
http://axcel.com.au/,Results,"ÓÉą7642 Lafayette St, Hannibal, MO 63401",Hannibal,MO,Óāį(701) 259-4484
https://www.loansbyworld.com/locations/branches/mo-hannibal-3535-stardust-dr-1143?utm_source=google&utm_medium=organic&utm_campaign=loc&utm_content=cm-13gbp------bid-1143,Results,"ÓÉą3535 Stardust Dr, Hannibal, MO 63401",Hannibal,MO,Óāį(573) 231-0907
https://www.sunloan.com/find-a-branch/sun-loan-company-hannibal-missouri-241/?utm_source=gmb&utm_medium=llm&utm_term=local&utm_campaign=gmbllm,Results,"ÓÉą361 US-61, Hannibal, MO 63401",Hannibal,MO,Óāį(573) 221-2904
https://locations.marinerfinance.com/missouri/personal-loans-in-hannibal-mo?utm_source=google&utm_medium=gmb_directories&utm_campaign=directories,Results,"ÓÉą2801 St Marys Ave A, Hannibal, MO 63401",Hannibal,MO,Óāį(573) 248-0503
https://www.incometaxquincyil.com/,Results,"ÓÉą1909 Jefferson St, Quincy, IL 62301",Quincy,IL,Óāį(217) 224-0919
